Recipe name,Ingredients,Image link,Main information,Recipe steps
Феттуччини с лисичками,"[{'Феттучини': '(или любая другая паста) 200 гр.'}, {'Лисички': '300-500 гр.'}, {'Репчатый лук': '(шалот) 1 шт.'}, {'Чеснок': 'несколько долек'}, {'Тимьян': 'несколько веточек'}, {'Сливки 20 %': '250 мл.'}, {'Пармезан': '50 гр.'}, {'Сливочное масло': 'немного для жарки'}, {'Оливковое масло': 'немного для жарки'}, {'Соль': 'по вкусу'}, {'Свежемолотый перец': 'по вкусу'}]",https://cooklikemary.ru/sites/default/files/img_0032_1_0.jpg,"[{'Время подготовки': 'до 15 мин.'}, {'Время готовки': 'до 30 мин.'}, {'Сложность рецепта': 1}, {'На какое количество человек расчитан рецепт': '3'}]","[{'1': 'Промойте лисички. Удобно замочить их на пару минут в емкости с водой, а затем откинуть на дуршлаг.\r\nНарежьте мелко лук и чеснок, измельчите тимьян. Разогрейте большую сковороду и обжарьте на смеси оливкового и сливочного масел лук и чеснок до золотистого цвета. \r\nНе забудьте поставить кастрюлю воды для феттуччине.'}, {'2': 'Если лук уже красивый (но не горелый, ведь он жарился на приличном количестве масла), добавьте грибы, тимьян и жарьте до полного выпаривания жидкости. Когда вода выпарится, прожарьте немного грибы до золотистого-коричневого цвета. Посолите по вкусу. Грибы, я советую лучше лишний раз не мешать, а как бы потряхивайте сковороду (видели, как это делают крытые повара?). Так они останутся целыми.\r\nГрибы лучше обжарить в два этапа, в зависимости от их количества.'}, {'3': 'Отварите феттуччине согласно инструкции. Натрите сыр на мелкой терке. Смешайте в миске сливки, немного сыра, соль и свежемолотый перец.\r\nДобавьте к обжаренным грибам феттуччине. Я достаю их из кастрюли щипцами и перекладываю в сковороду. Налейте к феттуччине с грибами сливки и перемешайте (опять же удобнее щипцами). Можно добавить немного воды от пасты, если вам вдруг покажется «сухо». Выключите и закройте крышкой.\r\nПри подаче пасту с лисичками украсьте свежей травой (базилик, тимьян) и посыпьте пармезаном.'}]"
Котлеты из говядины с тыквой,"[{'Говядина': '700 гр.'}, {'Тыква': 'половина маленькой (примерно 300-400 гр.)'}, {'Белый хлеб': 'примерно 150 гр.'}, {'Молоко': '(или сливки 10 %) 150 мл.'}, {'Яичный белок': '2 шт.'}, {'Кукурузный крахмал': '2 ст.л.'}, {'Репчатый лук': '1-2 шт.'}, {'Соль': 'по вкусу'}, {'Черный перец': 'по вкусу'}]",https://cooklikemary.ru/sites/default/files/img_7839.jpg,"[{'Время готовки': 'до 60 мин.'}, {'Сложность рецепта': 1}, {'На какое количество человек расчитан рецепт': '8'}]","[{'1': 'Замочите белый хлеб в молоке.'}, {'2': 'Прокрутите с помощью мясорубки говяжий фарш вместе с луком, тыквой и хлебом (отжатым).\r\nТыква любит лук, не жалейте.\r\nДобавьте белки и кукурузный крахмал. Посолите, поперчите по вкусу и хорошо перемешайте.\r\nЧерный свежемолотый перец сможет очень выгодно подчеркнуть вкус.\r\nЕсли есть возможность, уберите готовый фарш в холодильник на 30 минут.'}, {'3': 'Мокрыми руками слепите котлеты. Разогрейте сковороду, добавьте масло и жарьте котлеты из говядины с тыквой на среднем огне до красивого золотистого цвета. Уменьшите огонь до минимума, закройте котлеты крышкой и жарьте до готовности еще минут 10.'}]"
Печеночные котлеты с салом,"[{'Говяжья печень': '700-800 гр.'}, {'Сало': '70-100 гр.'}, {'Репчатый лук': '1 шт.'}, {'Яичный белок': '2 шт.'}, {'Кукурузный крахмал': '3-4 ст.л'}, {'Соль': 'по вкусу'}, {'Черный перец': 'по вкусу'}, {'Растительное масло': 'для жарки'}]",https://cooklikemary.ru/sites/default/files/img_9469_2.jpg,"[{'Время подготовки': 'до 10 мин.'}, {'Время готовки': 'до 15 мин.'}, {'Сложность рецепта': 1}, {'На какое количество человек расчитан рецепт': '5'}]","[{'1': 'Очистите печень от пленки и прожилок, иначе они будут вам попадаться в котлетах. Разрежьте на кусочки и в несколько приемов измельчите с помощью блендера.\r\nТак же поступите с луком и салом.'}, {'2': 'Смешайте все ингредиенты в миске. Добавьте яичный белок, кукурузный крахмал, соль и перец по вкусу и перемешайте.'}, {'3': 'Разогрейте в сковороде растительное масло и жарьте на большом огне (или среднем) с каждой стороны примерно по 1 минуте. Печеночные котлеты с салом накладываются ложкой и готовятся гораздо быстрее классических. Не передержите. Кстати, они вкусные даже холодные)))'}]"
Простой клубничный пирог,"[{'Клубника': '300 гр.'}, {'Мука': '350 гр.'}, {'Кукурузный крахмал': '2 ст.л.'}, {'Разрыхлитель': '1,5 ст.л.'}, {'Яйцо': '2 шт.'}, {'Сливочное масло': '150 гр.'}, {'Сахар': '200-250 гр. + 50-70 гр. для ягод'}, {'Сметана': '5 ст.л.'}, {'Молоко': '120 мл.'}, {'Ванильный сахар': '7 гр.'}, {'Соль': 'щепотка'}]",https://cooklikemary.ru/sites/default/files/img_9985_2.jpg,"[{'Время подготовки': 'до 20 мин.'}, {'Время готовки': 'до 60 мин.'}, {'Сложность рецепта': 1}, {'На какое количество человек расчитан рецепт': '8'}]","[{'1': 'Чистую клубнику разрежьте на 2-4 дольки, засыпьте сахаром 50-70 гр. и оставьте на 30 минут. Затем откиньте клубнику на сито (из получившейся жидкости можно приготовить потом морс) и добавьте к ягодам крахмал. Аккуратно перемешайте ложкой.'}, {'2': 'Теплое сливочное масло взбейте с сахаром, ванильным сахаром и солью. Добавьте яйца и повторите. Затем введите молоко и сметану.'}, {'3': 'Добавьте просеянную с разрыхлителем муку и перемешайте тесто ложкой (не блендером). Выложите тесто в подготовленную форму (заранее смазанную сливочным маслом и присыпанную мукой). Сверху разложите ягоды, чуть вдавливая их в тесто. Выпекайте около 60 минут при 180 градусах. Проверьте зубочисткой, должна остаться сухой.'}]"
Ванильный крем для тарталеток,"[{'Title': 'Для крема'}, {'Молоко': '525 мл.;'}, {'Сахарная пудра': '120 г.;'}, {'Яичный желток': '6 шт.;'}, {'Кукурузный крахмал': '45 г.;'}, {'Стручок ванили': '1 шт.;'}, {'Сливочное масло': '50-55 г.'}]",https://cooklikemary.ru/sites/default/files/klubnika-tart-sweet-berries-delicious-iagody-chernika-korz-1.jpg,"[{'Время готовки': 'до 15 мин.'}, {'Сложность рецепта': 2}, {'На какое количество человек расчитан рецепт': '3'}]","[{'1': 'Для этого сладкого крема для тарталеток ванильный стручок разрежьте вдоль пополам и достаньте семена.\r\n\r\nСтручок и семена сложите в кастрюльку и залейте молоком. Доведите всё до кипения на среднем огне. Взбейте в отдельной миске желтки, сахар и кукурузный крахмал. Тоненькой струйкой влейте горячее молоко, продолжая взбивать. Когда смесь станет однородной, перелейте все обратно в кастрюлю. Поставьте на медленный огонь и доведите до кипения, постоянно помешивая венчиком. Продолжайте мешать еще 3-5 минут до загустения.\r\n\r\nСнимите с огня, протрите крем через сито (стручок ванили останется в сите). Введите по частям сливочное масло, размешивая до однородности.'}, {'2': 'Остудите сладкий крем для тарталеток, постоянно помешивая, чтобы на нем не образовалась пленочка и уберите в емкость с крышкой в холодильник до использования.'}]"
Тарталетки с ванильным кремом и свежими ягодами,"[{'Title': 'Тесто'}, {'Мука': '250 гр.;'}, {'Сахар': '2 ст.л.;'}, {'Желток': '2 шт.;'}, {'Сливочное масло': '120 гр.;'}, {'Соль': 'щепотка;'}, {'Холодная вода': '1-2 ст.л.'}, {'Title': 'Для крема'}, {'Молоко': '525 мл.;'}, {'Сахарная пудра': '120 гр.;'}, {'Яичный желток': '6 шт.;'}, {'Кукурузный крахмал': '45 гр.;'}, {'Стручок ванили': '1 шт.;'}, {'Сливочное масло': '50-55 гр.'}, {'Title': 'Для украшения'}, {'Свежие ягоды': 'клубника,малина,голубика и др.'}]",https://cooklikemary.ru/sites/default/files/img_9843_2.jpg,"[{'Время готовки': 'до 60 мин.'}, {'Сложность рецепта': 1}, {'На какое количество человек расчитан рецепт': '6'}]","[{'1': 'Рецепт песочного теста для тарталеток. Соедините в миске сахарную пудру, просеянную муку и соль. Нарежьте холодное сливочное масло на маленькие кубики и добавьте к сухим ингредиентам. Разотрите в крошку. Добавьте яйцо и хорошо перемешайте. Быстро замесите тесто и уберите в холодильник минимум на 30.'}, {'2': 'Ванильный заварной крем. Ванильный стручок разрежьте вдоль пополам и достаньте семена.\r\nСтручок и семена сложите в кастрюльку и залейте молоком. Доведите всё до кипения на среднем огне. Взбейте в отдельной миске желтки, сахар и кукурузный крахмал. Тоненькой струйкой влейте горячее молоко, продолжая взбивать. Когда смесь станет однородной, перелейте все обратно в кастрюлю. Поставьте на медленный огонь и доведите до кипения, постоянно помешивая венчиком. Продолжайте мешать еще 3-5 минут до загустения.\r\nСнимите с огня, протрите крем через сито (стручок ванили останется в сите). Введите по частям сливочное масло, размешивая до однородности.\r\nОстудите (на водяной бане), постоянно помешивая, чтобы на нем не образовалась пленочка и уберите в емкость с крышкой в холодильник до использования.'}, {'3': 'Смажьте небольшие формочки для тарталеток сливочным маслом и присыпьте мукой. Тонко раскатайте тесто, проткните его вилкой и равномерно распределите по дну и бортикам. Аккуратно положите фольгу в каждую форму и сверху присыпьте грузом в виде фасоли, риса и т.п. (см. рецепт пирога с ревенем) Выпекайте в хорошо разогретой духовке минут 20 при 180 градусах.\r\nЕсли у вас совсем маленькие формочки, то их можно не прикрывать фольгой. Но если как у меня, то я настоятельно советую это сделать, чтобы тарталетки оставались ровными и красивыми.\r\nПеред применением остудите.'}, {'4': 'Заполните остывшие тарталетки кремом. Удобно воспользоваться кулинарным мешком, так крем будет смотреться красивее.\r\nУкрасьте корзиночки с кремом свежими ягодами и по желанию присыпьте сахарной пудрой.'}]"
Бисквит королевы Виктории со сливочно-сырным кремом и клубникой,"[{'Title': 'Для бисквита'}, {'Мука': '460 гр.'}, {'Сливочное масло': '460 гр.'}, {'Сахар': '460 гр.'}, {'Яйцо': '(крупные) 8 шт.'}, {'Цедра лимона': '1 шт. (одного лимона)'}, {'Разрыхлитель': '3 ч.л.'}, {'Title': 'Для крема'}, {'Клубничное пюре': '200-300 гр.'}, {'Сахар': '1-2 ст.л'}, {'Кукурузный крахмал': '2 ст.л.'}, {'Клубника': 'примерно 250 гр.'}, {'Сахарная пудра': '110 гр.'}, {'Крем-чиз': '(альметте) 800 гр.'}, {'Ванильная эссенция': '(или стручок ванили, ванилин, ванильный сахар) по вкусу'}, {'Сливки': '(35 %) 150 мл'}]",https://cooklikemary.ru/sites/default/files/img_9579_1.jpg,"[{'Время готовки': 'до 120 мин.'}, {'Сложность рецепта': 1}, {'На какое количество человек расчитан рецепт': '8'}]","[{'1': 'Бисквит. Смажьте две формы 20 см сливочным маслом и присыпьте мукой. Включите духовку.\r\nВзбейте миксером масло комн.темп и сахар, до бела. Поочередно добавляйте яйца, каждый раз взбивая минимум минуту. В конце просейте муку с разрыхлителем (заранее перемешанную), добавьте цедру лимона (заранее натертую на мелкой тёрке) и перемешайте ложкой. Тесто для бисквита королевы Виктории разложите в равной пропорции в две формы.\r\nВыпекайте минут 30 при 190 градусах. Проверьте зубочисткой, должна быть сухая. Остудите на решетке. Если будете собирать торт не сразу, то упакуйте в пищевую плёнку и положите в холодильник.\r\nРазрежьте аккуратно бисквит на два коржа. У вас получится 4 коржа.'}, {'2': 'Рецепт сырно-сливочного крема для торта. Взбейте холодные сливки до пиков. Добавьте сахарную пудру в несколько приёмов. Затем введите творожный сыр и ванильную эссенцию по вкусу. Попробуйте на вкус, если необходимо добавьте еще сахара. Еще раз хорошо взбейте.\r\nКрем положите в кулинарный мешок и держите в холодильнике до использования.\r\nПопробуйте на вкус, если необходимо добавьте еще сахара.'}, {'3': 'Клубничный соус для торта. Разогрейте в сотейнике на плите клубничное пюре, добавьте крахмал и сахар по вкусу. Доведите до кипения и выключите. Порежьте ягоды на слайсы. Когда клубничный соус станет теплым, положите в нее порезанные ягоды и перемешайте.'}, {'4': '4. Сборка торта. Вырежьте круг из пергаментной бумаги размером с биквит. Застелите подставку, на которой будете собирать торт, как на фото. Положите вниз круг, а на него бисквит. \r\nВозьмите кисточку и промажьте бисквит клубничным соусом для торта (жидкой частью), а в середину бисквита положите ягоды вместе соусом. По бокам, от горки с ягодами, обильно промажьте кремом. Удобно наносить крем с помощью кулинарного мешка. Следите за тем, чтобы крема хватило на весь торт. Таким же образом поступите и с другими бисквитами.\r\nВыровняйте крем на торте, воспользовавшись кулинарным скребком.\r\nУкрасьте по вашему вкусу.\r\nСлушайте ваше настроение и включайте фантазию, не бойтесь экспериментировать, видоизменяя рецепт бисквита королевы Виктории. Свежие ягоды, зефир, безе и другие всевозможные вариации.'}]"
Азиатский суп с курицей,"[{'Куриный бульон': '2 л.'}, {'Кукуруза мини': 'примерно 150 гр.'}, {'Редька дайкон': 'примерно 150 гр.'}, {'Зеленый стручковый горошек': 'примерно 150 гр.'}, {'Морковь': 'примерно 100-150 гр.'}, {'Имбирь': 'примерно 1-2 см'}, {'Соевый соус': 'по вкусу (примерно 5 ст.л.)'}, {'Васаби': 'немного по вкусу'}, {'Фунчоза': '50-70 гр.'}, {'Соль': ''}, {'Title': 'Для подачи'}, {'Кинза': '(или лук резанец)'}, {'Title': 'Для бульона'}, {'Морковь': '1 шт.'}, {'Корень сельдерея': '1/3 небольшого корня'}, {'Лук порей': '(белая часть) 1 шт. (возможно заменить на репчатый)'}, {'Лавровый лист': '2-3 шт.'}, {'Черный перец горошком': '2-3 шт.'}, {'Цыпленок': '1 небольшой или куриная грудка на кости с кожей'}]",https://cooklikemary.ru/sites/default/files/img_9302_2.jpg,"[{'Время подготовки': 'до 15 мин.'}, {'Время готовки': 'до 90 мин.'}, {'Сложность рецепта': 1}, {'На какое количество человек расчитан рецепт': '4'}]","[{'1': 'Сварите бульон любым удобным для вас способом. Не забывайте, что от вкуса бульона зависит вкус супа.\r\nМой вариант. Вскипятите курицу, первый бульон слейте. Промойте, залейте новой водой и доведите до кипения. Нарежьте в произвольном порядке для бульона корень сельдерея, морковь, лук-порей, добавьте лавровый лист и черный перец горошком и варите не менее 1 часа. Можно также добавить веточку тимьяна и дольку чеснока. Бульон процедите через сито, чтобы избавиться от всего ненужного.\r\nДостаньте курицу и нарежьте на маленькие кусочки.'}, {'2': 'Подготовьте все овощи (морковь, дайкон, кукуруза, горошек) и нарежьте их тонкой соломкой приблизительно одинакового размера. В суп можно добавить лук-порей, тоже нарезав его соломкой. Имбирь очистите и натрите на мелкой терке.'}, {'3': 'Добавьте овощи и натертый имбирь в бульон, доведите до кипения. Поварите пять минут и добавьте соевый соус и васаби по вкусу. Советую васаби растворить сначала в небольшом количестве бульона (блюдце), а потом только добавлять. Посолите. И варите еще минут пять-семь до готовности моркови. Выключите суп, добавьте фунчозу и курицу. Дайте постоять под крышкой несколько минут.\r\nПри подаче украсьте суп с фунчозой и курицей измельченной кинзой или луком.'}]"
