Recipe name,Ingredients,Image link,Main information,Recipe steps
Мясо по-французски,"[{'Говядина': '(идеально вырезка) 700 гр.;'}, {'Шампиньоны': '400 гр.;'}, {'Репчатый лук': '1 шт.;'}, {'Помидоры черри': '200 гр.;'}, {'Кабачок': '(по желанию) среднего размера 1 шт.;'}, {'Кукурузный крахмал': '(для кабачка) 1 ст.л.;'}, {'Сыр': '(полутвердый) 150 гр.;'}, {'Майонез': '100 гр.;'}, {'Горчица': '1 ст.л.;'}, {'Сметана': '100 гр.;'}, {'Кориандр': '(молотый) немного по вкусу;'}, {'Розмарин': '(свежий или сухой) немного по вкусу;'}, {'Соль': 'по вкусу;'}, {'Черный перец': 'по вкусу.'}]",https://cooklikemary.ru/sites/default/files/img_4893.jpg,"[{'Время подготовки': 'до 20 мин.'}, {'Время готовки': 'до 60 мин.'}, {'Сложность рецепта': 1}, {'На какое количество человек расчитан рецепт': '6'}]","[{'1': 'Подготовьте мясо, помойте и просушите. Порежьте на куски толщиной примерно 1 см. Сложите на доску, закройте пищевой пленкой и хорошенько отбейте. \r\nПосолите, поперчите, посыпьте молотым кориандром и свежим измельченным розмарином с обеих сторон.\r\nСмажьте противень оливковым маслом. Положите мясо, закройте пищевой пленкой и, по возможности, оставьте на 1 час.'}, {'2': 'Разрежьте лук на две части и порежьте на полукольца. Шампиньоны очистите с помощью бумажных полотенец и порежьте на слайсы.\r\nРазогрейте оливковое масло в большой сковороде и обжарьте на большом огне сначала лук. Как только он приобретет золотистый цвет, добавьте шампиньоны и продолжайте обжаривать. Через несколько минут грибы и лук будут готовы. Добавьте немного соли.\r\nПорежьте черри на две половинки. \r\nТеперь нарежьте кабачок слайсами толщиной примерно 1 см. Сложите кабачок в подходящую по размеру чашу. Добавьте 1 ст.л. кукурузного крахмала и крупную щепотку соли. Перемешайте.'}, {'3': 'В отдельной чаше соедините сметану, майонез и горчицу. Перемешайте. Это наш бешамель)))'}, {'4': 'На мясо выложите обжаренные грибы с луком. Добавьте черри и равномерно распределите по всему мясу. Сверху разложите нарезанные кабачки.\r\nРавномерно распределите соус с помощью ложки, а лучше кулинарной кистью.'}, {'5': 'Поставьте блюдо в хорошо разогретую духовку при 220 гр. (режим верх-низ)  примерно на 20-30 минут. \r\nКак только оно станет румяным, уменьшите температуру до 180 гр. и готовьте еще 20 минут.\r\nНатрите сыр на крупной терке.  Посыпьте готовое блюдо и готовьте еще минут пять, по возможности, на режиме гриль.\r\nПодавайте блюдо горячим с салатом из свежих овощей!'}]"
Кокосовый кулич,"[{'Мука': '250 гр.;'}, {'Кокосовая стружка': '50 гр.;'}, {'Яйцо': '1 шт.;'}, {'Сахар': '150 гр.;'}, {'Сливочное масло': '100 гр.;'}, {'Кокосовое молоко': '(или сливки) 150 мл.;'}, {'Стручок ванили': '1 шт. (возможно ванилин или ванильная эссенция);'}, {'Сметана': '2 ст.л. (без горки);'}, {'Сухофрукты': '100 гр. (манго, помело, изюм);'}, {'Лайм': 'цедра 1 шт.;'}, {'Кукурузный крахмал': '(по возможности) 1 ст.л.;'}, {'Разрыхлитель': 'неполная 1 ч.л.;'}, {'Сода': 'на кончике ч.л.;'}, {'Соль': 'щепотка;'}, {'Коньяк': '1 ст. л. (любой крепкий алкоголь или свежевыжатый сок).'}, {'Title': 'Для глазури'}, {'Белый шоколад': '100 гр.;'}, {'Сливки 20 %': '1 ст.л.;'}, {'Сахарная пудра': '80 гр.;'}, {'Сок лайма': 'немного по вкусу.'}]",https://cooklikemary.ru/sites/default/files/img_4854-2.jpg,"[{'Время подготовки': 'до 45 мин.'}, {'Время готовки': 'до 60 мин.'}, {'Сложность рецепта': 1}, {'На какое количество человек расчитан рецепт': '8'}]","[{'1': 'Советую за сутки до приготовления кулича мелко порезать сухофрукты и замочить их в одной столовой ложке коньяка. Также можно использовать свежевыжатый сок апельсина. Приготовьте и достаньте продукты заранее. Желательно,  чтобы они были комнатной температуры.'}, {'2': 'Растопите в сотейнике сливочное масло на небольшом огне. Разогрейте кокосовое молоко на плите. Если используете натуральную ваниль, разрежьте вдоль стручок ванили и очистите семена. Вскипятите семена в молоке вместе с очищенным стручком. Затем процедите.'}, {'3': 'В одной чаше взбейте яйцо с сахаром до пышной белой пены. Добавьте растопленное сливочное масло, теплое кокосовое молоко и сметану.'}, {'4': 'В другой чаше соедините просеянную муку, разрыхлитель, кокосовую стружку, немного соды и щепотку соли. Перемешайте.'}, {'5': 'Добавьте сухие ингредиенты к жидким. Положите в тесто подготовленные сухофрукты, по возможности, добавьте к ним 1 ст.л. кукурузного крахмала (или муки) и перемешайте.\r\nНатрите цедру лайма в тесто.'}, {'6': 'Налейте тесто на 2/3 от формы. Выпекайте в течение 50-60 минут при 180 градусах в заранее разогретой духовке. Время приготовления зависит от выбранной вами формы, в маленьких готовится быстрее. По возможности, используйте их.'}, {'7': 'Растопите белый шоколад на водяной бане (в сотейнике шоколад, разломанный на дольки, а под ним кипит вода в посуде большего диаметра при умеренном огне). Добавьте сливки, сахарную пудру и размешайте. Сбрызните соком лайма, чтобы «облегчить» сладость. Глазурь готова, теперь покройте ею остывшие куличи. Украсьте кокосовой стружкой и дайте застыть.'}]"
Цыпленок табака (тапака) в сливочно-аджичном соусе,"[{'Цыпленок': '(500-700 гр.) 1 шт.;'}, {'Сливочное масло': '(желательно топленое) 30 гр.;'}, {'Растительное масло': '1 ст.л.;'}, {'Хмели-сунели': 'по вкусу;'}, {'Кинза': 'немного для подачи;'}, {'Гранат': 'немного гранатовых зерен для подачи;'}, {'Title': 'Соус'}, {'Чеснок': 'несколько долек;'}, {'Сливки 10%': '200 мл.;'}, {'Сметана': '(20%) 2 ст.л.;'}, {'Аджика': '100 гр. (или по вкусу в зависимости от остроты);'}, {'Перец жгучий': '(если нет в аджике) немного по вкусу;'}, {'Соль': 'по вкусу'}]",https://cooklikemary.ru/sites/default/files/img_4659-2.jpg,"[{'Время подготовки': 'до 60 мин.'}, {'Время готовки': 'до 40 мин.'}, {'Сложность рецепта': 1}, {'На какое количество человек расчитан рецепт': '2'}]","[{'1': 'Заранее достаньте сливки и сметану, чтобы они стали комнатной температуры.'}, {'2': 'Помойте и просушите цыпленка бумажным полотенцем.\r\nПоложите цыпленка грудкой вверх и разрежьте грудку вдоль хребта.\r\nРасплющьте цыпленка так, чтобы он стал максимально плоским.\r\nНатрите цыпленка солью и специями по вкусу. Заверните в пищевую пленку в несколько слоев и хорошо отбейте (уделяя особое внимание суставам).\r\nЕсли позволяет время, оставьте мариноваться при комнатной температуре на 1 час.'}, {'3': 'Разогрейте подходящую по размеру (цыпленка) сковороду. Добавьте сливочное и растительное масло и дайте хорошо нагреться.\r\nВыложите цыпленка в горячее масло кожей вниз. Закройте грузом (например, тарелка + кастрюля с водой) и жарьте на сильном огне с обеих сторон до румяного цвета. А пока подготовьте соус.'}, {'4': 'Смешайте в миске сливки, сметану, аджику, выдавите чеснок и добавьте измельченный острый перец. Перемешайте, попробуйте на вкус и если необходимо добавьте соль.'}, {'5': 'Посмотрите на цыпленка, если на ваш взгляд масла слишком много, то слейте.\r\nВылейте соус к курице, подождите пока закипит, и уменьшите огонь до минимума. Закройте обычной крышкой и тушите примерно в течение 20 минут, один раз перевернув вашего цыпленка.'}, {'6': 'Подавайте вместе с соусом, украсив свежей кинзой и по желанию гранатовыми зернами. \r\nПриятного аппетита!'}]"
Пирог с судаком,"[{'Title': 'Тесто'}, {'Мука': '350 гр.;'}, {'Масло сливочное': '100 гр.;'}, {'Сметана': '100 гр.;'}, {'Яйцо': '1 шт.;'}, {'Сахар': '2 ст.л.;'}, {'Соль': 'щепотка;'}, {'Сода': '1/4 ч.л.;'}, {'Лимонный сок': '1 капелька;'}, {'Title': 'Начинка'}, {'Судак': '(филе) 700 гр.;'}, {'Яйцо': '(сваренное вкрутую) 2 шт.;'}, {'Репчатый лук': '1 шт.;'}, {'Сметана': '(20%) 150 гр.;'}, {'Майонез': '50 гр.;'}, {'Оливковое масло': '(или растительное) 2 ст.л.;'}, {'Петрушка': 'пучок;'}, {'Соль': 'по вкусу;'}, {'Яйцо + капелька молока для смазывания пирога': ''}]",https://cooklikemary.ru/sites/default/files/img_4333_0.jpg,"[{'Время подготовки': 'до 40 мин.'}, {'Время готовки': 'до 60 мин.'}, {'Сложность рецепта': 1}, {'На какое количество человек расчитан рецепт': '8'}]","[{'1': 'Тесто. Соедините в миске яйцо, сметану, соль с сахаром и перемешайте. Добавьте растопленное сливочное масло,  а после просейте к ним муку с содой (погасите капелькой лимонного сока). Быстро вымесите руками мягкое тесто, сделайте шар, заверните в пищевую пленку и уберите в холодильник минимум на 30 минут.'}, {'2': 'Если используете целую рыбу - разделайте её на филе. Филе нарежьте на небольшие кусочки, примерно 1 см. Сложите в небольшую миску, посолите и если надо поперчите по вкусу.'}, {'3': 'Сварите яйца вкрутую. Лук и яйца мелко нарежьте. Петрушку измельчите.\r\nРазогрейте в сковороде масло  и обжарьте лук до золотистого цвета. Затем добавьте рыбу жарьте еще пару минут. Выключите. Теперь добавьте яйца, сметану, майонез,  рубленую петрушку, перемешайте, посолите и остудите.'}, {'4': 'Подготовьте  разъемную форму примерно 24 см. Дно застелите бумагой для выпечки, края смажьте сливочным маслом.\r\nДостаньте  две трети теста  из холодильника и раскатайте.  Переложите в форму и разровняйте, сформировав достаточно высокие бортики. Проколите дно вилкой.\r\nВыложите начинку на тесто.\r\nРаскатайте оставшееся тесто и накройте пирог. \r\nЗащипните края, наколите дно пирога вилкой (или сделайте «вырез» как у меня), чтобы выходил пар.\r\nСмажьте пирог яйцом и выпекайте в заранее разогретой до 180 гр. духовке в течение примерно 45 минут. \r\n* Пирог лучше ставить на раскаленный противень, так ваше тесто будет хорошо пропеченным.\r\nПирог подавайте горячим или уже остывший подогрейте на самом маленьком огне на сковороде прикрытой крышкой.'}]"
"Творожная пасха с ванилью, цукатами и миндалем","[{'Творог': '500 гр. (сухой-9%)'}, {'Цукаты': '100 гр.'}, {'Сливочное масло': '90 гр.'}, {'Желток': '2 шт.'}, {'Сливки': '100 мл. (33%)'}, {'Сахарная пудра': '80 гр.'}, {'Миндаль': '30-50 гр.'}, {'Ваниль': '1 стручок'}]",https://cooklikemary.ru/sites/default/files/2017-03-30_14-10-04.jpg,"[{'Время подготовки': 'до 20 мин.'}, {'Время готовки': 'до 60 мин.'}, {'Сложность рецепта': 1}, {'На какое количество человек расчитан рецепт': '4'}]","[{'1': 'Творог оберните в марлю и придавите чем-то тяжелым, оставьте на 3 часа для стекания лишней жидкости. Достаньте заранее сливочное масло.'}, {'2': 'Творог протрите через сито. Удобно воспользоваться деревянной ложкой.'}, {'3': 'Цукаты ошпарьте и измельчите.'}, {'4': 'Стручок ванили разрежьте на половинки и выньте семена.'}, {'5': 'Миндаль измельчите или используйте кондитерский(лепестки).'}, {'6': 'Взбейте венчиком  (или блендером) сливочное масло с цукатами и орехи.'}, {'7': 'Желтки взбейте с сахарной пудры до белизны.'}, {'8': 'В небольшой сотейник налейте сливки и доведите до кипения, но не кипятите. Добавьте семена ванили.'}, {'9': 'Добавьте к сливкам взбитые желтки и непрерывно помешивая прогревайте на небольшом огне в течение 2-3 минут. Крем должен загустеть. Снимите с огня, размешайте и дайте немного остыть.'}, {'10': 'Добавьте в творог масло с цукатами и крем из сливок и желтка. Все еще раз хорошо взбейте.'}, {'11': 'Выстелите форму или дуршлаг двойным слоем марли и наполните ее творожной массой. Края марли заверните крест-накрест, сверху положите груз и поставьте минимум на сутки в холодильник.'}]"
Спагетти вонголе,"[{'Ракушки вонголе': '1 кг.;'}, {'Чеснок': '3-4 дольки;'}, {'Перец Чили': '1 шт.;'}, {'Петрушка': 'большой пучок;'}, {'Белое сухое вино': '100 мл.;'}, {'Спагетти': '300 гр.;'}, {'Помидоры черри': 'примерно 8 шт.;'}, {'Оливковое масло': 'по вкусу;'}, {'Соль': 'по вкусу;'}, {'Свежемолотый перец': 'по вкусу.'}]",https://cooklikemary.ru/sites/default/files/img_4155.jpg,"[{'Время подготовки': 'до 15 мин.'}, {'Время готовки': 'до 15 мин.'}, {'Сложность рецепта': 1}, {'На какое количество человек расчитан рецепт': '3'}]","[{'1': 'Переберите и удалите поврежденные ракушки. Тщательно и не один раз промойте ракушки под струей воды.'}, {'2': 'Ошпарьте помидоры черри. Очистите от кожуры и замаринуйте в оливковом масле, добавив соль и свежемолотый перец.'}, {'3': 'Нарежьте чеснок тонкими слайсами. У красного перца удалите перегородки и семена, а затем  нарежьте его тонкими полукольцами. Петрушку измельчите.'}, {'4': 'В большой кастрюле вскипятите воду и отварите спагетти, следуя инструкции на упаковке, уменьшив время варки на 3 минуты.'}, {'5': 'Одновременно в большой сковороде разогрейте оливковое масло. Обжарьте чеснок и чили на умеренном огне. Добавьте ракушки. Затем влейте вино и половник кипящей воды (от спагетти).\r\nНесколько минут готовьте ракушки на сильном огне до полного раскрытия. Потряхивайте сковороду туда-сюда, чтобы они равномерно готовились. Если есть нераскрывшиеся, не жалея, удалите.\r\n Добавьте спагетти, помидоры черри, петрушку и энергично перемешайте. \r\nДобавьте соль (если надо, ракушки и так соленые) и свежемолотый черный перец по вкусу.\r\nПодавайте ваше блюдо горячим немедленно!'}]"
Ростбиф,"[{'Говядина': 'примерно 1 кг.;'}, {'Оливковое масло': '3 ст.л.;'}, {'Сливочное масло': '1 ст.л.;'}, {'Чеснок': 'несколько долек;'}, {'Тимьян': '(по возможности) несколько веточек;'}, {'Розмарин': '(по возможности) несколько веточек;'}, {'Соль': 'по вкусу;'}, {'Черный перец': 'по вкусу.'}, {'Любой набор специй для говядины: розмарин, тимьян, зерна кориандра, молотая паприка, чили, зерна горчицы и т.п.': ''}]",https://cooklikemary.ru/sites/default/files/img_3710.jpg,"[{'Время подготовки': 'до 60 мин.'}, {'Время готовки': 'до 60 мин.'}, {'Сложность рецепта': 1}, {'На какое количество человек расчитан рецепт': '4'}]","[{'1': 'За час до приготовления натрите мясо оливковым маслом, солью, перцем и любыми специями по вкусу*. Заверните кусок в фольгу и оставьте при комнатной температуре.\r\n*По возможности используйте свежемолотые специи, хотя бы черный перец.'}, {'2': 'Подготовленный кусок для придания формы желательно обвязать кулинарными нитками.\r\nРазогрейте сковороду. Добавьте смесь оливкового и сливочного масла, несколько долек чеснока и травы для аромата (розмарин и тимьян). Обжарьте мясо на самом большом огне с каждой стороны, в том числе уделяя внимание бокам, до румяной красивой корочки.\r\nЕсли есть, используйте кулинарные щипцы, но, ни в коем случае, не протыкайте мясо вилкой.'}, {'3': 'На противень установите решетку. Полейте мясо оставшимся маслом, если есть положите  свежие травы (или добавьте немного сухих по вкусу), пару разрезанных долек чеснока. Закройте фольгой и выпекайте в заранее разогретой до 250 гр. духовке около 20 минут, затем уменьшите температуру до 180 и готовьте еще примерно 20-25 минут.\r\nГотовое мясо сразу не разрезайте, обязательно дайте ему постоять 20 минут.\r\nБлюдо можно подавать как горячим, так и холодным. Мне очень нравится холодное, особенно на следующий день, в сочетании с кусочком черного хлеба, овощами и каким-нибудь соусом.'}]"
