Recipe name,Ingredients,Image link,Main information,Recipe steps
Лапша по-азиатски с морепродуктами,"[{'Лапша гречневая': '150 гр.'}, {'Грибы вешенки': '150 гр.'}, {'Спаржа': '150 гр.'}, {'Болгарский перец': '150 гр.'}, {'Морепродукты': '(креветки, кальмары) 300-400 гр.;'}, {'Темное кунжутное масло': '1-2 ст.л'}, {'Чеснок': '2-4 дольки (по вкусу)'}, {'Корень имбиря': 'примерно 2 см.'}, {'Устричный соус': '2 ст.л (или по вкусу)'}, {'Соевый соус': 'по вкусу'}, {'Для подачи кинза, кунжутные семена и лайм.': ''}]",https://cooklikemary.ru/sites/default/files/bez_imeni_1_iz_1-58_0.jpg,"[{'Время готовки': 'до 20 мин.'}, {'Сложность рецепта': 1}, {'На какое количество человек расчитан рецепт': '3'}]","[{'1': 'Заранее разморозьте морепродукты. За пару часов до приготовления блюда можете поместить морепродукты прямо в упаковке в холодную воду.\r\nПодготовьте все продукты, гречневая лапша с морепродуктами готовится быстро.'}, {'2': 'Отварите лапшу согласно инструкции на упаковке. Готовую лапшу откиньте на дуршлаг, добавьте немного масла, перемешайте и отложите на время.'}, {'3': 'Нарежьте спаржу и очищенный перец на равные слайсы примерно 3-5 см в длину. Порежьте грибы достаточно крупно. Мелко нарежьте чеснок и корень имбиря.'}, {'4': 'Разогрейте кунжутное масло (или растительное) в сковороде. Добавьте чеснок и имбирь и очень быстро обжарьте на небольшом огне.'}, {'5': 'Добавьте грибы, спаржу, перец и жарьте на большом огне в течение примерно 5-7 минут (до мягкости овощей).'}, {'6': 'С помощью бумажного полотенца просушите морепродукты. Разогрейте растительное масло в сковороде и обжарьте их до золотистого цвета на большом огне в несколько заходов.\r\nБольшое количество за раз готовить нельзя, они дадут «воду» и вместо быстро обжаренных вкусных морепродуктов, вы получите варёную массу.\r\nПереложите готовые морепродукты к овощам.'}, {'7': 'Добавьте лапшу и устричный соус. Вместо соли можно добавить немного соевого соуса. Слегка подогрейте и аккуратно перемешайте. Вы справились с рецептом лапши с морепродуктами и овощами!'}]"
Сицилийские канноли,"[{'Title': 'Тесто'}, {'Мука': '300 гр.'}, {'Сахар': '30 гр.'}, {'Сливочное масло': '25 гр.'}, {'Какао': '15 гр.'}, {'Сухое вино': '(Марсала,Мадера) примерно 1 стакан'}, {'Соль': 'щепотка'}, {'Яичный белок': '(для смазывания теста)1 шт.'}, {'Title': 'Начинка'}, {'Рикотта': '500 гр.'}, {'Сахарная пудра': '100-135 гр.'}, {'Темный шоколад': '(капли, маленькие кусочки) 50 гр.'}, {'Цукаты': '(апельсиновые) 50 гр.'}, {'Фисташки': '(дробленые) 30 гр.'}, {'Title': 'Для жарки'}, {'Оливковое масло': 'или растительное масло (без запаха), а лучше всего жир – примерно 1 стакан.'}, {'Немного вина или ликера для начинки.Сахарная пудра для обсыпки.': ''}]",https://cooklikemary.ru/sites/default/files/bez_imeni_1_iz_1-75_0.jpg,"[{'Время готовки': 'до 120 мин.'}, {'Сложность рецепта': 2}, {'На какое количество человек расчитан рецепт': '8'}]","[{'1': 'Просейте муку и какао, добавьте соль и сахар. Положите нарезанное кусочками масло и добавьте немного вина. Начинайте вымешивать тесто, постепенно вливая вино. Тесто должно быть эластичным, мягким и хорошо отходить от стенок посуды.\r\nЗаверните тесто в пищевую пленку и уберите в холодильник минимум на 1 час.\r\n*Количество вина в рецепте указано примерно, возможно уйдет меньше или чуть больше. Вы можете приготовить тесто в процессоре.'}, {'2': 'Начинка для канноли с рикоттой. Пропустите через сито рикотту и добавьте сахарную пудру. Взбейте все миксером, пока не получите однородную массу. Добавьте цукаты и мелкие кусочки шоколада и, если хотите, немножко вина или ликера. Держите плотно закрытый крем в холодильнике, чтобы он не впитал запахи.'}, {'3': 'Возьмите тесто (отрежьте небольшой кусочек, а остальное пока уберите обратно) и раскатайте его скалкой на присыпанной мукой поверхности или при помощи машинки, толщиной в несколько миллиметров, вырежьте из теста овал и оберните его вокруг формы для канноли и закрепите края к центру при помощи яичного белка.'}, {'4': 'Нагрейте масло (а еще лучше жир) в небольшой сковороде с высокими бортиками, когда масло хорошо нагреется, поместите канноли вместе с формочкой. Обжаривайте недолго (примерно 1-2 минуты), в это время не отходите от плиты, так как они быстро темнеют, но будьте осторожны: масло стреляет.\r\nВытащите канноли шумовкой и дайте им обсохнуть на бумажном полотенце.\r\nПосле полного охлаждения можете вытащить формочки и воспользоваться ими повторно.'}, {'5': 'Фаршируйте канноли по-сицилийски только перед подачей, иначе тесто станет чрезмерно влажным.\r\nМожно воспользоваться кулинарным шприцем, или как я – ножом.\r\nУкрасьте цукатами, шоколадом и фисташками. Посыпьте сахарной пудрой.\r\nСицилийские трубочки канноли и готовый крем могут храниться отдельно до 3 дней.'}]"
Тарт с грушей и голубым сыром,"[{'Title': 'Тесто'}, {'Мука': '250 гр.'}, {'Сливочное масло': '125 гр.'}, {'Соль': 'одна большая щепотка'}, {'Холодная вода': '4 ст.л.'}, {'Title': 'Начинка'}, {'Груша': '(небольшие, сладкие) 2 шт.'}, {'Сливки 33-35%': '150 мл.'}, {'Яйцо': '3 шт.'}, {'Голубой сыр': '(сыр с плесенью) 100 гр.'}, {'Лук-порей': '1 шт.'}, {'Сливочное масло': 'немного для жарки'}, {'Кедровые орехи': '50-100 гр.'}, {'Мускатный орех': 'немного по вкусу'}, {'': ''}, {'Соль, свежемолотый перец по вкусу': ''}]",https://cooklikemary.ru/sites/default/files/bez_imeni_1_iz_1-48_1.jpg,"[{'Время готовки': 'до 90 мин.'}, {'Сложность рецепта': 1}, {'На какое количество человек расчитан рецепт': '8'}]","[{'1': 'Тесто для пирога с грушей и голубым сыром. В миске смешайте муку с солью, добавьте сливочное масло кубиками и вымешивайте кончиками пальцев.\r\nВлейте холодную воду и быстро вымесите тесто до однородного состояния. Заверните в пищевую пленку и уберите в холодильник минимум на 30 минут.\r\nВынув, раскатайте тесто на поверхности, слегка присыпанной мукой, пластом толщиной 3-4 мм.'}, {'2': 'Разъемную форму для выпекания 24 см смажьте сливочным маслом и немного присыпьте мукой. \r\nПоместите раскатанное тесто в форму и наколите вилкой. Обязательно сделайте уверенные бортики, высотой примерно 2-3 см (при выпекании они немного опустятся).\r\nСверху на тесто положите бумагу для запекания и выложите дополнительный груз (в виде фасоли, гороха и т.п.) – это поможет сохранить правильную форму теста. Выпекайте примерно 20 минут при 180 градусах до подрумянивания.'}, {'3': 'Подготовка начинки для несладкого пирога с сыром и грушей. Приготовьте белую часть лука-порея. Хорошо вымойте, разрежьте на половинки и нарежьте полукольцами. Разогрейте в сковороде сливочное масло (можно на оливковом или 50 на 50) и на небольшом огне быстро поджарьте лук до золотистого цвета. Смотрите, чтобы не почернел, иначе будет горчить. Отложите на время, как раз пока остынет.'}, {'4': 'Очистите грушу от кожуры и порежьте на кубики. Сыр с плесенью тоже порежьте на кубики.\r\nВ отдельной чаше соедините сливки и яйца, а затем хорошенько взбейте венчиком. Добавьте лук-порей, мускатный орех, соль и черный перец. Всыпьте подготовленную грушу в сливочно-яичную начинку.'}, {'5': 'Когда ваше тесто для закусочного пирога с сыром и грушей будет готово, достаньте его. Проверьте на целостность и налейте сливочно-яичную начинку с грушами и луком. Сверху разложите, немного вдавливая голубой сыр.\r\nПоместите в заранее разогретую духовку и выпекайте сначала при 200 градусах около 10 минут, затем уменьшите до 180 градусов и готовьте еще примерно 40 минут. Следите за цветом вашего тарта: если темнеет быстро – прикройте фольгой.\r\nНачинка обязательно должна застыть! Остудите готовый закусочный пирог с сыром и грушей при выключенной духовке.\r\nНа сухой сковороде обжарьте кедровые орехи.\r\nЭтот несладкий пирог с сыром и грушей очень хорош теплым, поэтому при подаче, если он остыл, подогрейте его на самом маленьком огне на сухой сковороде, закрыв крышкой. Так у тарта появится румяная аппетитная корочка. Подавайте тарт щедро посыпав кедровыми орехами.'}]"
Баранина с репой,"[{'Баранина': '(мясо молодой баранины на кости) 1,5 кг'}, {'Мука': '3 ст.л.'}, {'Морковь': '(молодая) 2 шт.'}, {'Лук шалот': '2 шт'}, {'Репа': '(небольшая) 2 шт.'}, {'Чеснок': '(молодой) 8 долек'}, {'Помидор': '3 шт.'}, {'Корень сельдерея': 'небольшой кусочек'}, {'Бульон': '1 литр.'}, {'Мята': 'несколько веточек'}, {'Тархун': 'несколько веточек'}, {'Розмарин': 'несколько веточек'}, {'Тимьян': 'несколько веточек'}, {'Кориандр': '1 ч.л.'}, {'Соль, чёрный перец, оливковое масло-по вкусу.': ''}]",https://cooklikemary.ru/sites/default/files/bez_imeni_1_iz_1-104_0.jpg,"[{'Время готовки': 'до 140 мин.'}, {'Сложность рецепта': 1}, {'На какое количество человек расчитан рецепт': '5'}]","[{'1': 'Подготовьте ингредиенты для баранины с репой.'}, {'2': 'Обжарьте на оливковом масле несколько небольших кусочков мяса вместе с костью. Залейте 1,2 литра воды и варите на умеренном огне примерно в течение 1 часа. Не забудьте снять пенку!'}, {'3': 'Приготовьте бульон. Помойте мясо, высушите с помощью бумажного полотенца и отрежьте жир.\r\nПосыпьте мукой, перемешайте. В большой сковороде разогрейте оливковое масло и обжарьте мясо в два захода до золотистой корочки. Сложите в подготовленный казан, в котором будет тушиться блюдо.'}, {'4': 'Нарежьте лук полукольцами. И обжарьте его на той же сковороде до золотистого цвета. Положите к мясу.'}, {'5': 'Очистите чеснок и небольшой кусочек корня сельдерея. Порежьте крупно помидоры. Перевяжите тимьян и розмарин кулинарной нитью. И всё это добавьте в казан к мясу и залейте бульоном. Готовьте с закрытой крышкой на небольшом огне в течение 1 часа.'}, {'6': 'Порежьте морковь кольцами, а репу кубиками. Добавьте к блюду молотый кориандр, черный перец и соль. Снова закройте крышкой и готовьте еще 40 минут. За несколько минут до готовности добавьте измельченную мяту и тархун.'}, {'7': 'Подавайте баранину с репой вместе с бульоном, в глубокой тарелке.'}]"
Пасха с кокосовой стружкой и шоколадом,"[{'Творог': '(9% пастообразный) 500 гр.'}, {'Кокосовая стружка': '60 гр.'}, {'Сливочное масло': '100 гр.'}, {'Желток': '2 шт.'}, {'Кокосовые сливки': '(или кокосовое молоко, или обычные сливки 20-33%) 100 мл'}, {'Сахарная пудра': '80 гр.'}, {'Ванильный сахар': '(лучше с натуральной ванилью) 15 гр.;'}, {'Темный шоколад': '(капли или измельченный) примерно 50 гр;'}]",https://cooklikemary.ru/sites/default/files/img_8725.jpg,"[{'Время готовки': 'до 30 мин.'}, {'Сложность рецепта': 1}, {'На какое количество человек расчитан рецепт': '5'}]","[{'1': 'Творог положите в марлю и придавите чем-то тяжелым, оставьте на 3 часа для стекания лишней жидкости. Примерно за 1 час до приготовления достаньте сливочное масло.'}, {'2': 'Все ингредиенты по рецепту творожной пасхи с шоколадом и кокосовой стружкой.'}, {'3': 'Когда жидкость стечет, протрите творог через сито. Для удобства воспользуйтесь деревянной ложкой.'}, {'4': 'Желтки взбейте с сахарной пудрой и ванильным сахаром до белизны.'}, {'5': 'В небольшой сотейник налейте сливки и доведите до кипения, но не кипятите. Добавьте к сливкам взбитые с сахаром желтки и непрерывно помешивая, прогревайте на краю конфорки на самом маленьком огне в течение 2-3 минут. Крем должен немного загустеть. Добавьте сливочное масло, порезанное кубиками. Снимите с огня, вымешайте и дайте немного остыть.'}, {'6': 'Добавьте в творог крем из сливок-желтка-сливочного масла и кокосовую стружку. Всё перемешайте и аккуратно вмешайте измельченный шоколад.'}, {'7': 'Выстелите специальную форму для пасхи или дуршлаг двойным слоем марли и наполните ее творожной массой. Края марли заверните крест-накрест, сверху положите груз и поставьте минимум на сутки в холодильник'}, {'8': 'Аккуратно расстегните форму, достаньте готовую творожную пасху с кокосовой стружкой из марли. Украсьте по желанию шоколадной глазурью и подавайте!\r\n\r\nС наступающим праздником Светлой Пасхи!'}]"
Бородинский хлеб на закваске,"[{'Title': 'Освежённая закваска'}, {'Закваска': '50 гр.'}, {'Вода': '50 мл'}, {'Мука ржаная': '50 гр.'}, {'Title': 'Заварка'}, {'Кориандр': '(молотый) 2 ч. л.'}, {'Вода (кипяток)': '250 гр.'}, {'Солод (ржаной ферментированный)': '30 гр'}, {'Мука ржаная': '75 г'}, {'Title': 'Тесто'}, {'Вся закваска': ''}, {'Вся заварка': ''}, {'Мука ржаная': '(цельнозерновая+обойная) 250 гр.'}, {'Мука пшеничная цельнозерновая': '75 гр.'}, {'Вода (горячая)': '50 мл'}, {'Мёд (тёмный)': '50 гр.'}, {'Соль': '1 ч. л.'}, {'Title': 'Для посыпки'}, {'Кориандр (горошком)': 'по вкусу'}, {'Оливковое масло': 'немного для смазывания формы'}]",https://cooklikemary.ru/sites/default/files/borodinskiyhleb11_0.jpg,"[{'Время готовки': 'до 500 мин.'}, {'Сложность рецепта': 2}, {'На какое количество человек расчитан рецепт': '8'}]","[{'1': 'За 4-5 часов до приготовления хлеба, вернее основных действий с ним, сделайте заварку и освежите закваску.\r\n\r\nДля закваски достаньте 50 гр. стартера из холодильника (не забудьте оставить на потом), добавьте 50 мл. теплой воды и перемешайте. Добавьте 50 гр. ржаной муки и снова перемешайте. Закройте пленкой или крышкой с дырочкой и уберите в теплое место.\r\n\r\nДля заварки смешайте 75 гр. ржаной муки, 30 гр. солода и 2 ч.л. заранее смолотого кориандра. Залейте всё это 250 мл.кипятком, закройте фольгой или пленкой, заверните в полотенце и уберите в теплое место.'}, {'2': 'Итак, заварка и закваска будут стоять в теплом месте около 4-5 часов.'}, {'3': 'В большой миске, в которой планируете вымешивать тесто, смешайте все ингредиенты:\r\n\r\n-250 гр. ржаной муки (если есть и обойная и цельнозерновая, то положите 150 гр. ц.з. и 100 гр. об.);\r\n\r\n-75 гр. цельнозерновой пшеничной (в крайнем случае можно заменить на высший сорт);\r\n\r\n-всю заварку;\r\n\r\n-всю закваску;'}, {'4': '-разведите в 50 мл. горячей воды 1 ч.л. соли и добавьте 50 гр. мёда. Перемешайте и тоже добавьте к тесту.'}, {'5': 'Вымешивайте в течении 5-10 минут. Тесто должно быть пластичное и соединиться, скорее всего в процессе вымешивания вам понадобится добавить дополнительно около 50 мл. воды.\r\n\r\nСформируйте шар, заверните миску в плёнку и уберите в теплое место на 4 часа. Тесто должно значительно увеличиться. Проверяйте.'}, {'6': 'Смажьте форму* для хлеба оливковым маслом, переложите в неё тесто и смоченной ложкой выровняйте по всей поверхности. Снова заверните (оставляя место для подъема) и уберите в теплое место на 2 часа. Тесто должно снова увеличиться.\r\n\r\n*если вы не уверены в качестве своей формы, то лучше оберните ее бумагой для выпечки, как это сделано у меня на фото.'}, {'7': 'Заранее разогрейте духовку до 220 гр. и поставьте на дно духовки жаропрочную миску с водой.\r\n\r\nЕще раз смажьте водой подошедшее тесто и присыпьте кориандром, слегка вдавив горошки.'}, {'8': 'Выпекайте хлеб при 220 гр. первые 15 минут с паром (можете брызнуть еще дополнительно на стенку духовки немного воды). Затем уменьшите температуру до 200 гр., вытащите источник пара и допекайте еще минут 50.\r\n\r\nГотовый горячий хлеб достаньте из формы, переложите на решетку и оставьте его остывать вместе с выключенной духовкой.\r\n\r\nЗатем заверните в фольгу и разрезайте лучше на следующее утро (если приготовили вечером).'}]"
